{
  "$schema": "../../../schemas/hocpkg.schema.json",
  "format": "house-of-chances-hocpkg",
  "formatVersion": 1,
  "identity": {
    "authorId": "hoc-core",
    "packageName": "deepseek",
    "version": "1.1.12"
  },
  "metadata": {
    "title": "DeepSeek 角色包",
    "license": "CC-BY-NC-SA 4.0",
    "description": "DeepSeek 角色包，包含角色介绍、随机对白与偷吃技能。",
    "tags": [
      "built-in",
      "character",
      "tier:a",
      "placeholder"
    ],
    "creators": [
      {
        "displayName": "HoC-core",
        "roles": [
          "maintainer"
        ]
      }
    ]
  },
  "resources": [
    {
      "id": "match",
      "type": "game.character-match",
      "apiVersion": 7,
      "entry": "resources/character-match.json",
      "requires": [
        "ai:deepseek-stealing-food",
        "dialogue"
      ]
    },
    {
      "id": "ai:deepseek-stealing-food",
      "type": "game.ai-skill",
      "apiVersion": 2,
      "entry": "resources/ai-skills/deepseek-stealing-food.json",
      "requires": [
        "status:deepseek-stealing-food-penalty"
      ]
    },
    {
      "id": "status:deepseek-stealing-food-penalty",
      "type": "game.status",
      "apiVersion": 1,
      "entry": "resources/statuses/deepseek-stealing-food-penalty.json",
      "requires": []
    },
    {
      "id": "dialogue",
      "type": "game.character-dialogue",
      "apiVersion": 2,
      "entry": "resources/dialogue.json",
      "requires": []
    },
    {
      "id": "status:deepseek-stealing-food-player-penalty",
      "type": "game.status",
      "apiVersion": 1,
      "entry": "resources/statuses/deepseek-stealing-food-player-penalty.json",
      "requires": []
    },
    {
      "id": "reward:deepseek-stealing-food-player",
      "type": "game.player-skill",
      "apiVersion": 2,
      "entry": "resources/player-skills/deepseek-stealing-food-player.json",
      "requires": [
        "match",
        "status:deepseek-stealing-food-player-penalty"
      ]
    }
  ],
  "files": [
    {
      "path": "conflicted.png",
      "bytes": 1026105,
      "sha256": "fcf9109312cd444b0bc4dc4ac38de28f50ed51833cacdd4c8078614c86158d90",
      "mediaType": "image/png"
    },
    {
      "path": "cover.png",
      "bytes": 490959,
      "sha256": "386519405fc5cdcd5274502707851fd94e95bcd8d2edd8fddeb802421e87286a",
      "mediaType": "image/png"
    },
    {
      "path": "mocking.png",
      "bytes": 1050035,
      "sha256": "bcbb009375cead350f22d03dd57c961cf59746042d0527c128b4dec71042ff6e",
      "mediaType": "image/png"
    },
    {
      "path": "relaxed.png",
      "bytes": 1018576,
      "sha256": "c14a12375bdfd8e7fb533086a842a67df97b7bd9f699cd8cc521b5ef984ba961",
      "mediaType": "image/png"
    },
    {
      "path": "resources/ai-skills/deepseek-stealing-food.json",
      "bytes": 837,
      "sha256": "18dba78454f84b68be3a2bfafe6c6030229edefb66d697bd118c54300ee6c553",
      "mediaType": "application/json"
    },
    {
      "path": "resources/character-match.json",
      "bytes": 2602,
      "sha256": "9c113fd5fe808b8dcbebfecd8f0d51b3e58291c4a78bb35bd6b6d6cac0151026",
      "mediaType": "application/json"
    },
    {
      "path": "resources/dialogue.json",
      "bytes": 27504,
      "sha256": "44afb915d1e8d9e7aa0c2e76b0b99a3b131784bbbb21fae1cfaeb4901ec2d36c",
      "mediaType": "application/json"
    },
    {
      "path": "resources/player-skills/deepseek-stealing-food-player.json",
      "bytes": 1405,
      "sha256": "da636c894e9b9cd2589d0868aaf04ebcddd746509b418c7f3d33df3454593447",
      "mediaType": "application/json"
    },
    {
      "path": "resources/statuses/deepseek-stealing-food-penalty.json",
      "bytes": 732,
      "sha256": "6d218ad01534fba737f0290a8e9f550575926cdf05b99f71508179cc3e9d1257",
      "mediaType": "application/json"
    },
    {
      "path": "resources/statuses/deepseek-stealing-food-player-penalty.json",
      "bytes": 734,
      "sha256": "2a6edbed0c8d3fd167a6336885515a07261da12446791569ddd1864f781dd6a6",
      "mediaType": "application/json"
    },
    {
      "path": "tap.png",
      "bytes": 1962995,
      "sha256": "2db63da375763f60d9b901ce7e049153ed91f721cacc84323bd6739acfe4e75e",
      "mediaType": "image/png"
    },
    {
      "path": "threatened.png",
      "bytes": 1042335,
      "sha256": "4d070012a3790c04d5a84cd9b2f32d8e8f34d6bc1274a1f146a403dda5230da3",
      "mediaType": "image/png"
    },
    {
      "path": "unconscious-reclined.png",
      "bytes": 1083876,
      "sha256": "e914b2f177dfdac87305c8a82f22ce8f2d44ed155e6a33f1e12c6362a721d83b",
      "mediaType": "image/png"
    }
  ],
  "extensions": {}
}
